{
  "$schema": "https://json-schema.org/draft/2020-12/schema",
  "$id": "qa-setupkit/bug.schema.json",
  "title": "Defect (BUG-NNN row)",
  "type": "object",
  "required": [
    "id",
    "date",
    "severity",
    "component",
    "summary",
    "repro",
    "expected",
    "actual"
  ],
  "properties": {
    "id": {
      "type": "string",
      "pattern": "^BUG-[0-9]{3,}$"
    },
    "date": {
      "type": "string",
      "pattern": "^[0-9]{4}-[0-9]{2}-[0-9]{2}$"
    },
    "severity": {
      "enum": [
        "Critical",
        "Major",
        "Medium",
        "Low",
        "High",
        "Info"
      ],
      "$comment": "General QA uses Critical/Major/Medium/Low; High/Info additionally allowed for Security-Testing findings (that kit's scale)"
    },
    "severityBranch": {
      "type": "string",
      "$comment": "which severity-decision-tree branch fired, e.g. 'tree #3: degradation at scale' — expected when agent-filed"
    },
    "priority": {
      "enum": [
        "P0",
        "P1",
        "P2",
        "P3"
      ]
    },
    "priorityProposed": {
      "type": "boolean",
      "$comment": "true = priority is the agent's PROPOSAL pending owner confirmation (default when agent-set); owner flips to false on triage"
    },
    "component": {
      "type": "string",
      "$comment": "endpoint / screen / feature, e.g. 'POST /books (isTesting:false)'"
    },
    "summary": {
      "type": "string",
      "minLength": 10
    },
    "repro": {
      "type": "array",
      "minItems": 1,
      "items": {
        "type": "string"
      }
    },
    "expected": {
      "type": "string"
    },
    "actual": {
      "type": "string"
    },
    "evidence": {
      "type": "array",
      "items": {
        "type": "string"
      },
      "$comment": "links: sheet tabs, result files, screenshots, run docs"
    },
    "tags": {
      "type": "array",
      "items": {
        "enum": [
          "SECURITY",
          "PERFORMANCE",
          "DATA-LOSS",
          "UI",
          "CONTENT",
          "FLAKY",
          "A11Y",
          "LOCALIZATION",
          "COMPAT"
        ]
      }
    },
    "invariantViolated": {
      "type": "string",
      "pattern": "^INV-[0-9]+$",
      "$comment": "per Test-Oracles: every bug implies an invariant — reference or create one"
    },
    "status": {
      "enum": [
        "open",
        "fixed",
        "verified",
        "reopened",
        "wontfix",
        "duplicate"
      ],
      "$comment": "internal QA lifecycle — independent of the team board's workflow state (see boardStatus)"
    },
    "layer": {
      "enum": [
        "app",
        "backend",
        "frontend-web"
      ],
      "$comment": "defect layer; drives the tracker subject prefix: app → [BUG-App], backend → [BUG-BE], frontend-web → [BUG-FE] (no layer → [BUG])"
    },
    "boardStatus": {
      "enum": [
        "To do",
        "In progress",
        "To test",
        "QA in Progress",
        "Reopen",
        "Fixed"
      ],
      "$comment": "team tracker/board workflow state (Redmine board + Bug Reports v2 tab column D dropdown) — separate vocabulary from the internal status field"
    },
    "escapedFromCycle": {
      "type": "string",
      "$comment": "release/cycle id this bug escaped from (production-found bugs only) — feeds the escape-rate metric"
    },
    "duplicateOf": {
      "type": "string",
      "pattern": "^BUG-[0-9]{3,}$"
    }
  },
  "additionalProperties": false
}
